"title","body","post-time"
"Church conversation for Mother's Day Service - m4m","I looked up from my seat and saw you looking around for somewhere to sit, so I offered the spot next to me. I told you it was my first time at this church. You were wearing jeans, a sweater, glasses and a dress shirt. We chatted a bit about the pastors at the church, the duration of the service, and you handed me a book of devotions on our way out. I'd like to chat more with you and just get to know you. There aren't many gay Christians in NYC (assuming you're gay), and it would be nice to get to know others. Tell me your name again and what service was about so that I know it's you.","2016-05-09 1:01am","40.765100","-73.963800","body : athletic"
"6 train uptown from Spring to Union Square - m4w (Downtown)","We both got on the 6 train at Spring St heading uptown around 4pm. You: an angel. Tall, light brown hair, jeans, tan scarf, and black Doc Marten-esque boots. You had me with those eyes of yours. Me: black leather jacket, dark brown hair and a beard. You smiled and got off at Union Square. I was on my way to Grand Central to catch a train upstate and take my mom out for Mother's Day. As you walked off the train and the doors lingered open, I thought she would understand if I was late chasing love, so I hopped off just as the doors closed. I caught a glimpse of you walking up the stairs with about eighty people between us. I made my way up quickly, but once up top you had disappeared. So I exited the station and looked for you down every line of sight. Nothing. Then I thought maybe one last hope; you might have been heading to Brooklyn and transferring to the L. So I hustled back in and hoped to find you on the L platform, but you had vanished into thin air. Would love the chance to talk to you and discover what's behind those beautiful eyes.","2016-05-09 12:44am","40.721957","-73.996782"
"If you think you might be a sex addict","Knowing you are a sex addict doesn't mean you are bad or perverted or hopeless. It means you may have a disease, an obsession from which many have healed. Dr. Patrick Carnes Sexual addiction is defined as any sexually-related compulsive behavior which interferes with normal living and causes severe stress on family, friends, loved ones, and one's work environment. Like an alcoholic unable to stop drinking, sexual addicts are unable to stop their self-destructive sexual behavior. This aggression may display itself in a multitude of negative ways, even abuse toward others. Sex addicts come from all walks of life: male and female, all sexual orientations, ages from pre-teens to senior citizens, those employed as laborers or CEOs of major organizations. Sex addiction does not discriminate. Many addicts were abused as children -- sexually, physically, and/or emotionally. Many grew up in families in which addiction already flourished, including alcoholism, drugs, gambling, and/or compulsive eating. Most grapple with other addictions in addition to sex addiction, but often find overcoming sexual addiction the most difficult. Much hope nevertheless exists for these addicts and their families. Sex addicts have shown an ability to transform a life of self-destruction into a life of self-care, a life in chaos and despair into one of confidence and peace. Dr. Patrick Carnes, Out of the Shadows (1983). Can sex be addictive? Yes, it can. First, it is important to understand what addiction is. Understanding the basic fundamentals can help you compare sex addiction to other types of addiction you may be more familiar with, such as drugs or alcohol. Although there are not any substances such as cocaine or beer involved, the brain releases certain chemicals during the performance of sexual behaviors that create the same type of ""high"" feeling as addictive substances. It is these ""high"" feelings that become addictive, and therefore, the behavior that helped create that feeling becomes necessary, not voluntary. Dr. Patrick Carnes in his book, Contrary to Love: Helping the Sexual Addict states, ""Contrary to enjoying sex as a self-affirming source of physical pleasure, the sex addict has learned to rely on sex for comfort from pain, nurturing, or relief from stress, etc., the way an alcoholic relies on alcohol, or a drug addict on drugs."" It is important to note that just because a person feels good or euphoric after sex or some other sexual behavior that he or she is an addict. If you are concerned you may be addicted to sex or a sexual behavior, please reach out to one of our specially trained therapists for help. Contrary to Love: Helping the Sexual Addict (1989), Dr. Patrick Carnes. How much is too much? The trend in the current psychological literature about ""How much is too much"" has changed over the years. We no longer quantify (or put a number to) how many times a day is too much. Rather, we look at it from a quality of life viewpoint; meaning that a 21-year-old can have sex or masturbate several times a day and still be ""okay."" The problem, we believe, becomes a problem when the sexual acting out behavior impairs other areas of life. For example, having unprotected sex with many anonymous partners and thereby putting oneself at risk to catch STDs or HIV; masturbating to the point of injury; missing school or work because he or she is busy engaging in or recovering from the sexual activity; continues behavior despite consequences (loss of job, legal problems, broken relationships, etc). Is your behavior a problem? Did you know there are 20 identified behavioral categories of sexual behaviors? Within these categories there are 164 different behaviors that have been identified as problem areas for sex addicts. Just like drug addicts who may have a problem with heroin, but not meth, not all addicts have every behavior and not all behaviors indicate addiction, though if continued, can lead to that in some cases. Some behaviors just cause more problems for some people. There are some questions you can ask yourself to determine if a behavior might be problematic: Does it hurt you? Do you feel as though you need to do the behavior? Does it hurt someone else? (physical, emotional, financial, etc.) You will be asked a simple series of Yes/No questions and presented with a profile comparing your responses with others who have taken the test. Our process ensures that no one but you will know your results. There is no information to link you with your assessment. We include further suggestions at the conclusion of your assessment. The Sexual Addiction Screening Test (SAST) is designed to assist in the assessment of sexually compulsive behavior which may indicate the presence of sex addiction. Developed in cooperation with hospitals, treatment programs, private therapists, and community groups, the SAST provides a profile of responses which help to discriminate between addictive and non-addictive behavior. Before starting the assessment we need basic information in order to build your profile. see recovery zone dot com /tests/lib/UCCASSv1.8.1/survey.php?sid=53","2016-05-08 11:31pm"
"Man-up-strip-down.....masturbate - w4m","al natural, fit with curves, blonde, white, large labia'd, clean female, in a clean-covert space a I host. Interested? Send for.more info.","2016-05-09 12:13am","0.000000","0.000000"
"POUR on Amsterdam - m4m (Upper West Side)","Hi there, M (name withheld)! I came in with my friend (an older lady) on Saturday afternoon and you were working! You let us sample your favorite ros and the red wine with sheet music on the label...clearly I judge wines by their cover. We ended up buying 2 sparkling ross and your favorite. We went home to watch the Kentucky Derby and toasted you. Remember me? Let me know!","2016-05-09 12:12am","40.780561","-73.980210","age: 26"
"Happy Mother's Day - m4w","Said it elsewhere but I say it here just for you. Love love love...he loves you yeah yeah yeah...","2016-05-08 11:43pm","40.680638","-73.663330"
"Girl in a Long Coat and a Short Dress - m4w (Manhattan)","I saw you coming down Sixth Avenue in Chelsea on Tuesday, late afternoon. You are young. I am older. You were wearing a long coat with a short dress. The coat was open and I could see two small tears in your stockings. I wondered if you knew they were there. Our eyes met for a brief moment and held. I wish now that I had said something to you. I hope you see this ad and contact me.","2016-04-19 8:50am","40.737941","-73.996246"
"Columbus circle d train - m4m (Harlem / Morningside)","I have never done this and probably a long shot but you where riding the d train uptown around 10:45pm you have a navy collard shirt with a leather bag shitting down. I got on the train at Columbus circle. I was wearing a Bergendy hoodie and jeans. We kept making casual eye contact at each other. I got off at 145 and looked and smiled when I got off. I thought you where really really cute. Love to meet you if you ever find this lol","2016-05-08 11:15pm","40.826500","-73.938300","age: 25"
"DB218: Read This!!! - m4w","Just putting this out there in the universe..... I still think about you after all these years. What I really miss is all those kinky times we shared in the bedroom If you want to reconnect and have some discret fun, please reply to this post with the name of video store.","2016-05-08 10:39pm"
"db218 - hope you see this - m4w","Just putting this out there in the universe... It's been a very long time and I still think about you. Do you still think about me? I really miss all the fun we had in the bedroom. You were so hot and open minded. We had some kinky times..... the toys, the dress up, the chat lines, and the role playing, I miss hearing you talk about your fuck stories while you layed next to me in bed and watched me stroke for you. I really, really want to meet up again and have those kinky intimate times with you, again. If you feel the same, and want to explore with me, discretely, of course, then reply to this post with a familiar dogs name in the subject line so I know it's you. Hope this post finds you happy and healthy. Also, saw a picture of you recently, you are more beautiful then ever!!!","2016-05-08 10:39pm"
"db218 - hope you see this - m4w","Just putting this out there in the universe... It's been a very long time and I still think about you. Do you still think about me? I really miss all the fun we had in the bedroom. You were so hot and open minded. We had some kinky times..... the toys, the dress up, the chat lines, and the role playing, I miss hearing you talk about your fuck stories while you layed next to me in bed and watched me stroke for you. I really, really want to meet up again and have those kinky intimate times with you, again. If you feel the same, and want to explore with me, discretely, of course, then reply to this post with a familiar dogs name in the subject line so I know it's you. Hope this post finds you happy and healthy. Also, saw a picture of you recently, you are more beautiful then ever!!!","2016-05-08 10:38pm"
"B'way Lafayette F Train SUNDAY 2:30 PM - m4m (Manhattan)","You: Very cute (of course) with dark dancing eyes that didn't look away when I did. A smalll peace sign tattoed on your left wrist. Your face became a gathering of dimples when you returned my smile. Which you did several times. You were dressed in black, yourcurly hair was black, too. You had a a gray scarf tied to your satchel. ME? Blond bob, bangs. Beige retro-geek glasses, brown scarf and gray blazer. We were both aware of my departure. If I wasn't on the verge of being late somewhere, I'd have stayed on the train to find a way to converse with you. You said, ""Have a nice day."" I said, ""Peace."" I should have said, ""Check Craigslist missed connections.""","2016-05-08 10:17pm","40.727330","-73.993006","body : thin"
"Barnes and Noble - Michael - m4m (Union Square)","We met in the Barnes and Noble on Union Square. You spoke to me about what you're looking for in life, and your job in finance. You asked for my number, and I was a little taken by surprise. I regretted denying that. I would love to speak further, platonically. Please email me with my name, and what I do for a living.","2016-05-08 9:53pm","40.731300","-73.989200"
"Lightning in a bottle - w4m (Midtown)","That's what it felt like when we first shook hands.. Did you feel the electricity too? It was torture to sit next to you and not engage in conversation, I wanted to find out everything about you but the timing and opportunity wasn't right. The thought of you crossed my mind several times, I had your contact info, but couldn't think of a witty way to reach out. And then last night I saw you again. We briefly chatted, you left to sit down at your table and I reluctantly went back to mine. Perhaps our paths may cross again?","2016-05-08 9:48pm"
"green bean - w4w (Midtown West)","we agreed a while ago that if we ever lost contact with each other we'd post on here with the title ""green bean"" fuuuuuuck i miss you. i love you so much. you know who you are. please talk to me. i don't want to run into you without being able to hug you. i might cry. i have cried. i was very hurt for a while, then angry, then sad for you and me and i'm all of those things now. i'm sorry that this isn't a beautiful note. i was going to send a letter in the mail. i hope you know that i love you. i don't think you do. i care about you so much. when you feel ready please contact me. we have a lot of talking to do. i'm so mad at you and i know you are very upset with me. let's resolve this. i'm reminded of you at least 5 times a day. i miss the times when i would text you 30 times a day and you'd actually respond. i love you.","2016-05-08 8:55pm","body : skinny"
"I would love to meet a nice happy ts girl to date - m4t (manhattan)","I would like to meet a nice and happy ts girl to date. I am single and miss having someone to share my days with. I like walking around the city, finding places to get a drink or eat, going to see bands, going to the movies. I am 41 white guy if that matters to you. I don't have any kids I am from NYC","2016-05-08 8:01pm","40.753239","-73.966742","body : thin"
"GET ON YOUR KNEES!! now m4w m4mw - m4w (nyc)",""".....Suddenly, he sits up and tugs my panties off and throws them on the floor. Pulling off his boxer briefs, his erection springs free."" I'm here to be playful, safe yet uncontrollablely satisfying! Couples are welcome Beyond discreet, prefer older sophisticated women. E! No responses to emails without, a brief description of yourself and a picture is worth a thousand words! ","2016-05-08 8:24pm"
"Got off the 1 train at 157th around 6:15pm - m4m (Inwood / Wash Hts)","You white, me black, probably around the same age. We were sitting next to each other headed uptown, legs touching. Pressed together even. I think maybe you allowed me to see the background image on your cell home screen? As you were leaving, we made eye contact a few times. You nodded, I smiled. Email me?","2016-05-08 7:51pm","New York : New York"
"Equinox Greenwich 4:30pm - m4m (West Village)","I was in the last row of lockers on the left hand side getting ready at around 4:30 today and looked up right as you were walking past me to the sink area. You smiled and then I did but we didn't get a chance to say hi in that setting. Send a photo if you think it's you as you're very handsome and I'd like to chat.","2016-05-08 7:14pm","body : athletic"
"To you Ervin - w4m (Harlem / Morningside)","Ervin mick I hope you see this you piece of shit.I regret the day I met your ugly ass.","2016-05-08 7:08pm","40.664500","-73.755900","New York : New York"
"west side path - m4w (Inwood / Wash Hts)","We were both lingering around the same area of the westside path in inwood/washington heights for a while. You were taking a bunch of photos. I was the bearded guy in the hat who should have struck up a conversation.","2016-05-08 6:54pm","40.849600","-73.935600"
