"title","body","post-time"
"NYSC Mad/36 Sunday- seeking Mike - m4m (Midtown)","Hey mike Such a hot thick muscular body Tan, tatted hot hairy chest You had some chains around your neck. Loved the way you took over- kissing me licking me sucking my dick and finger fucking me. I want you man Tell me how I can find you I'm the younger lean smooth guy with brown hair","2016-05-09 11:08am","40.744300","-73.978100"
"Central Park, a violin, and a magical atmosphere - w4m (Central Park)","I have never done this before and who knows if you will ever see this, but here it goes...! You sat next to me on Sunday in Central Park by the violinist, sandwiched between two statues, amongst beautiful white and purple tulips. I first saw you standing by one of the statues, and I was trying to make eye-contact without being creepy. Then you left, but came back and sat by me on the bench. The breeze picked up and was blowing the elm seeds and flower petals everywhere. As I was trying to get them out of my hair and scarf, I apologized for blowing more of them your way. You didn't mind. And I said I thought it all seemed magical until allergies attack. You laughed. Then you took out a notebook, jotted down something, wished me a good day and left. I really regret not talking to you more, but I can be shy at first- and I think that may be the case for you too. You seemed interesting to me, and you had really nice eyes :) If you see this, maybe we can meet in the park again, listen to the violin, and maybe talk a little more than we did yesterday.","2016-05-09 11:26am","40.770272","-73.974209"
"Bergdorfs - m4w (57th and Fifth)","Your were coming out of Bergdorfs yesterday as I was entering and I held the door for you. You were dressed to show your best and I was in blue suit. I think you saw me look back and wink. Contact me and lets see if this plays out as steamy as the looks would indicate. Discretion assured. Put ""Bergdorfs"" in title of your reply.","2016-05-09 10:24am","body : fit"
"We spoke in elevator. - m4w (Midtown)","Hello to the woman who held the elevator for me at the madison towers last week. You hit the 12th floor button for me. We made some small talk. You were dressed as if you just finished exercising. You got off on the 11th floor. I have to say, you have an incredible body. I should of stepped off on the 11 th floor as well. Perhaps you will read this ????","2016-05-04 11:33am","40.744300","-73.978100"
"Attractive Blonde on 6 Train - m4w (Union Square)","Attractive woman with kinky blonde hair and wearing black dress that boarded the 6 train on Lex line at 14th Street/Union Square with me. After we exchanged smiles I got off at Astor Place while you stayed on the train. Message me (the classy man in the grey suit).","2016-05-02 8:30am","body : fit"
"Theatre District Restaurant - m4w (Midtown West)","We were at adjoining tables at dinner three weeks ago on Saturday night. My spouse and I were with another couple and you and your husband were dining with others too. You have shoulder length blonde hair and we made eye contact several times.","2016-05-09 10:24am","body : fit"
"we chatted in elevator - m4w (Midtown East)","Hello to the woman who held the elevator for me at the madison towers last week. You hit the 12th floor button for me. We made some small talk. You were dressed as if you just finished exercising. You got off on the 11th floor. I have to say, you have an incredible body. I should of stepped off on the 11 th floor as well. Perhaps you will read this ????","2016-04-22 2:09pm","40.751700","-73.970700"
"Re Trust","Ouch, that's harsh. Try taking it slower next time. Give in a way that doesn't have you expecting. Enjoy the day and what you know without looking too far ahead. Appreciate the moments. Then give it one day at a time. Keep it positive and enjoy the person's company or keep it to a fond memory. Don't jump 10 steps ahead. Enjoy the present. Know the person's character before getting involved. Be friends first with no bennies or you may cloud your mind. Learn to ask the right questions and learn to listen to the answers. Many times the writing is on the wall. It's possible that you refused to see/accept it. The right person won't harm your heart. It's your duty to protect/heal it for that person. Learn to be open while knowing yourself and your boundaries. Communicate. Don't confuse lust with love, or you may be left wondering what happened. Good faith may be given anytime you decide. It says that you're open to what the Universe will bring. Real trust, on the other hand, takes time. Remain open, don't rush it. Most importantly, take time to heal by connecting to and with the people and things you enjoy. Don't give more energy to the person who caused you pain. Set yourself free. You decide.","2016-05-09 9:03am"
"For you - m4w","Good Morning Precious, I love you. ............................................................................................................","2016-05-09 8:12am"
"Bridge runners cromags 10k, you led the stretch - m4w","We both ran the Cromags 10k(ish) last week, ending by South Street Seaport. You led the stretch at the end. You were super cute. How do I see you again?","2016-05-09 8:55am"
"Beauty beheld on 1 train at 103 Saturday night - m4w (Upper West Side)","We saw each other on the 1 train Saturday night (April 30th) just before 10:30. You are the most beautiful woman I've ever seen. You've got amazing blond hair, which you had arranged really well with hairpins, gorgeous soft eyes and lips, and you were wearing a cute jean jacket with chest pockets and tight black pants. We made eyes at each other between 96th and 103rd, where I got off. As I was leaving, I believe we both felt something undeniable and strong...your gaze as I walked away left me breathless and I instantly regretted my decision to leave the train and go home. I, in a daze, actually pulled out a piece of paper and wrote my number down on it, as the train was pulling away, scolding myself for not having thought of doing it earlier. It would have been so simple! I guess something held me back from approaching you...life will be simpler in a few months than it is right now. I wish that I see you again somewhere, and next time I won't make that same mistake. Your stunning visage is indelible to me now. I'll be looking out for you and I hope you will affirm that that moment won't just fleet away.","2016-05-02 10:22am","40.797500","-73.968300","body : fit"
"Scruffy TodayTix agent with NP hat - m4m (Midtown)","My bf and I got our tickets for Fun Home from you on Saturday 5/7. You told us we were going to cry. I wanted to tell you the NastyPig jockstrap I was wearing matched your ballcap. What are you into?","2016-05-09 8:53am"
"I walked away from her - m4t (Midtown East)","Why is love so complicated. I am married to one woman that cheated on me for years and eventually threw m Me out. During that dark period I met someone special but the ex begged me to take her back used the children to pull on My heart . I broke the girlfriend s heart by returning back home. I am happy to spend every day with my children but I find myself thinking so much about my russian love. I hate what I did to her and I think about her every day.","2016-04-25 4:07pm","40.754055","-73.976278"
"Trust - m4w (Midtown)","To trust is to take a knife of an intangible nature and meticulously remove an invisible piece of one's own heart to place in another's care, and to be forever unsure of their intention to place it in a jar for eternal maintenance, or to eat it in front of you, just to watch, as you die internally.","2016-05-09 7:37am","40.764933","-73.978597"
"ISO BLACKOREA/HARLEM/LONG ISLAND CITY/LA OR NYC? - m4w (Harlem / Morningside)","who are you and where are you? sorry for iso don't want to call you out maybe you or one of your friends or someone who knows you will see this we met Sat 3/19 after your soul dinner with new shoes we arrived separately strangers from same town at Harlem hot spot red wine at first bartender got it wrong u were v nice we were feeling it u had to leave to get up v v early we both wanted to continue but did not know how u texted I pushed away am sorry no deetz how can we find each other now? msg me here plz put name or descr where we met so I know it's you thx","2016-05-09 7:50am","40.807930","-73.945177"
"Missing Cop. - w4m (Midtown West)","It's been more than a month since I met a cop. We've been together for just a night. But I'm still thinking of him. I tried not to, but I couldn't resist his memory in me. He brought out a piece of me, I never thought existed. After that night, I felt something was different. *** It was almost 2AM when I got into The Mean Fiddler. That was my last day in New York. I'm a humanitarian worker and human rights activist. Just like others, I'd rather watch late night news, than go clubbing. But that day was different. I wanted to experience New York's nightlife. I gave it to myself because tomorrow, I would be in India and things would be different. So I thought, that was my final chance. I didn't want to miss it. I was on the dance floor, when I met him. His friend introduced me to him. He said they were celebrating his retirement. He approached me. He was wearing a big smile and his eyes were gleaming. He was so inviting. How could I resist. We danced. I couldn't stop staring at him, while he moved his body towards me. I was so mesmerized. I never believe in love at first sight, but that was different. I felt something very special about him. It was so intense and it was making me tremble. So, I just asked his name. He said, ""I'm Kevin."" I asked what he does. ""I'm a cop."" My fantasy was doomed. Everybody has prejudices, and I am not an exception. I experienced being beaten by cops in my country. I remember an instance after a human rights protest. I was looking for my flip-flops that I lost during the dispersal, and a cop grabbed me and hit me. It was a painful experience. After that moment, every time I see a cop, I feel fear and hatred. Now, I'm dancing with him. It was really uncomfortable. I was so attracted to him, but it felt not right. He is a cop. I'm an activist. Why are we dancing?! I wanted to walk away, call it a day and just go back to my hotel room. But in a very soft voice, he asked, ""Are you okay?"" I could feel his concern. I was so confused. I couldn't reconcile my prejudices and the man in front of me. I wanted to leave, but there was something that pulls me to him. I couldn't leave him. The feeling was so intense and extraordinary. I didn't want to miss it. So, we continued dancing. I danced like it's the last dance of my life. We were like flowing water dancing with fire. It was so soothing, but fiery. Then he kissed me. It was so daring. I never had been kissed that way before. It was so wonderful and ecstatic. He kissed away all the fears and hatred, I had felt. It was so bold. I couldn't resist not wanting more. But, The Mean Fiddler was about to close. I thought I don't this to be over yet. I don't want to miss the chance of being with him. So, I asked him if he wants to come with me. He did. We went to my hotel room, and continued dancing. But this time, we danced our desires. I was drunk, but I can remember every detail of our one night romance. It was so different. I was never touched, the way he touched me. I was never caressed, the way he did. I felt a special connection with him. I felt more than lust. Then, we reached the peak of our impulses. I let it go and surrendered. Everything was overflowing. It was so cold and soothing. Then, I woke up. I was lying beside him. I felt the tranquility I was yearning to feel. I felt so secure and calm. I never felt what way before. I always woke up anxious and vulnerable. But this time, it was bliss. I was really touched by his presence. I kept on staring at him while he sleeps -- his cute pointed nose and thin lips, his broad shoulders, his tattoo all over his arms. . .Everything is perfect about him. But unfortunately, everything is not perfect about us. I'm a humanitarian worker and activist from the global south. New York is only for short engagement, because the United Nations is there. But it's not the space I wanted to be. While, he belongs to New York and he is making the city a safe place to live in. I was afraid our romance is not feasible. I was afraid if I will push it through, one of us had to leave the people whom we are serving. We both belong to where the people need us most. So, I stood up and started packing my things. My flight was in the next couple of hours. Then, he woke up. It was already 8:45AM. He had an appointment and needed to leave. He gets dressed and about to go. I hugged him so tight. I know this might be the last time that I could hug him. I never wanted to let go. But I needed to. Then, he asked if I want to go out and dance with him again. I said, ""I'm leaving."" He left. That was the end of it. I continued packing my things, and then went to the airport. I was so sober and confused. I like him so much, but I was so afraid. I wanted to hold his hands, but I was trembling. Then, when I was about to board the plane going to Abu Dhabi, I felt something was wrong. I felt, I did the wrong thing. But it was too late. I missed the opportunity to keep someone who is so precious. Then, I arrived at my destination. It was midnight in Mumbai. The first thing I did upon getting into my hotel room was to search for his name online. But I couldn't remember his last name. It might be, Bradley, Bodley, Codley, Moloney, Langley, or whatever. All I remember was it ended with ""-y"" or maybe not. I was so hopeless. I felt it's over, and there's nothing that I could do anymore. So, days passed. I was in the middle of a meeting, when something popped into my mind. ""Oh! Kevin is with the NYPD!"" Four letters can save me. So, I searched on the NYPD's website, Twitter and Facebook page. He might have a picture or full name there. I was so hopeful. But then, there were none. I couldn't find him. I was so frustrated. I was losing hope. I know I needed to stop my fondness for him. I thought, maybe when I go back to my country, things will be different. I might be missing home. So I did. But then, I failed. Right after I arrived, I was lying down on my bed and about to close my eyes, when I felt something was missing. It's him again. There's no point in denying. I left a part of my heart in New York. So, everyday, I take a look at the NYPD's page, hoping to see him -- the photos of the Saint Patrick's Day parade, the posts about the retirees, the activities, the troopers. . . I know there are thousands of police officers in New York and the probability of seeing him is almost negative. But, I want to try. I'm still hoping that one day, I will be able to see him. If not, I just want him to know, in the midst of all uncertainties, one thing I'm confident is certain: He stayed with me. The Mean Fiddler. The dance. The kiss. The romance. They will be in my heart, wherever I go. His memories will be with me; in the different countries I set foot on, and in the different continents I cross. Because he wasn't just a cop. He wasn't just a man in uniform. He's the man who brought out a piece of me, I never thought existed. He is the man whom I like so much. And I want him to know, that someone is thinking of him. Someone is hoping that he is safe, while protecting the people of New York. I badly want him to be safe. And, though we live on the opposite sides of the world, but we share the same passion and love for the people. Though his night is my day, but we're under the same sun and breathing the same air. And someday, we might meet again, or maybe not anymore. But, I'm just here waiting on the dance floor, for him to dance with me. ###","2016-05-09 2:53am","40.756620","-73.969402"
"Looking for the cop I met in Manhattan - w4m (Midtown West)","It's been more than a month since I met a cop. We've been together for just a night. But I'm still thinking of him. I tried not to, but I couldn't resist his memory in me. He brought out a piece of me, I never thought existed. After that night, I felt something was different. *** It was almost 2AM when I got into The Mean Fiddler. That was my last day in New York. I'm a humanitarian worker and human rights activist. Just like others, I'd rather watch late night news, than go clubbing. But that day was different. I wanted to experience New York's nightlife. I gave it to myself because tomorrow, I would be in India and things would be different. So I thought, that was my final chance. I didn't want to miss it. I was on the dance floor, when I met him. His friend introduced me to him. He said they were celebrating his retirement. He approached me. He was wearing a big smile and his eyes were gleaming. He was so inviting. How could I resist. We danced. I couldn't stop staring at him, while he moved his body towards me. I was so mesmerized. I never believe in love at first sight, but that was different. I felt something very special about him. It was so intense and it was making me tremble. So, I just asked his name. He said, ""I'm Kevin."" I asked what he does. ""I'm a cop."" My fantasy was doomed. Everybody has prejudices, and I am not an exception. I experienced being beaten by cops in my country. I remember an instance after a human rights protest. I was looking for my flip-flops that I lost during the dispersal, and a cop grabbed me and hit me. It was a painful experience. After that moment, every time I see a cop, I feel fear and hatred. Now, I'm dancing with him. It was really uncomfortable. I was so attracted to him, but it felt not right. He is a cop. I'm an activist. Why are we dancing?! I wanted to walk away, call it a day and just go back to my hotel room. But in a very soft voice, he asked, ""Are you okay?"" I could feel his concern. I was so confused. I couldn't reconcile my prejudices and the man in front of me. I wanted to leave, but there was something that pulls me to him. I couldn't leave him. The feeling was so intense and extraordinary. I didn't want to miss it. So, we continued dancing. I danced like it's the last dance of my life. We were like flowing water dancing with fire. It was so soothing, but fiery. Then he kissed me. It was so daring. I never had been kissed that way before. It was so wonderful and ecstatic. He kissed away all the fears and hatred, I had felt. It was so bold. I couldn't resist not wanting more. But, The Mean Fiddler was about to close. I thought I don't this to be over yet. I don't want to miss the chance of being with him. So, I asked him if he wants to come with me. He did. We went to my hotel room, and continued dancing. But this time, we danced our desires. I was drunk, but I can remember every detail of our one night romance. It was so different. I was never touched, the way he touched me. I was never caressed, the way he did. I felt a special connection with him. I felt more than lust. Then, we reached the peak of our impulses. I let it go and surrendered. Everything was overflowing. It was so cold and soothing. Then, I woke up. I was lying beside him. I felt the tranquility I was yearning to feel. I felt so secure and calm. I never felt what way before. I always woke up anxious and vulnerable. But this time, it was bliss. I was really touched by his presence. I kept on staring at him while he sleeps -- his cute pointed nose and thin lips, his broad shoulders, his tattoo all over his arms. . .Everything is perfect about him. But unfortunately, everything is not perfect about us. I'm a humanitarian worker and activist from the global south. New York is only for short engagement, because the United Nations is there. But it's not the space I wanted to be. While, he belongs to New York and he is making the city a safe place to live in. I was afraid our romance is not feasible. I was afraid if I will push it through, one of us had to leave the people whom we are serving. We both belong to where the people need us most. So, I stood up and started packing my things. My flight was in the next couple of hours. Then, he woke up. It was already 8:45AM. He had an appointment and needed to leave. He gets dressed and about to go. I hugged him so tight. I know this might be the last time that I could hug him. I never wanted to let go. But I needed to. Then, he asked if I want to go out and dance with him again. I said, ""I'm leaving."" He left. That was the end of it. I continued packing my things, and then went to the airport. I was so sober and confused. I like him so much, but I was so afraid. I wanted to hold his hands, but I was trembling. Then, when I was about to board the plane going to Abu Dhabi, I felt something was wrong. I felt, I did the wrong thing. But it was too late. I missed the opportunity to keep someone who is so precious. Then, I arrived at my destination. It was midnight in Mumbai. The first thing I did upon getting into my hotel room was to search for his name online. But I couldn't remember his last name. It might be, Bradley, Bodley, Codley, Moloney, Langley, or whatever. All I remember was it ended with ""-y"" or maybe not. I was so hopeless. I felt it's over, and there's nothing that I could do anymore. So, days passed. I was in the middle of a meeting, when something popped into my mind. ""Oh! Kevin is with the NYPD!"" Four letters can save me. So, I searched on the NYPD's website, Twitter and Facebook page. He might have a picture or full name there. I was so hopeful. But then, there were none. I couldn't find him. I was so frustrated. I was losing hope. I know I needed to stop my fondness for him. I thought, maybe when I go back to my country, things will be different. I might be missing home. So I did. But then, I failed. Right after I arrived, I was lying down on my bed and about to close my eyes, when I felt something was missing. It's him again. There's no point in denying. I left a part of my heart in New York. So, everyday, I take a look at the NYPD's page, hoping to see him -- the photos of the Saint Patrick's Day parade, the posts about the retirees, the activities, the troopers. . . I know there are thousands of police officers in New York and the probability of seeing him is almost negative. But, I want to try. I'm still hoping that one day, I will be able to see him. If not, I just want him to know, in the midst of all uncertainties, one thing I'm confident is certain: He stayed with me. The Mean Fiddler. The dance. The kiss. The romance. They will be in my heart, wherever I go. His memories will be with me; in the different countries I set foot on, and in the different continents I cross. Because he wasn't just a cop. He wasn't just a man in uniform. He's the man who brought out a piece of me, I never thought existed. He is the man whom I like so much. And I want him to know, that someone is thinking of him. Someone is hoping that he is safe, while protecting the people of New York. I badly want him to be safe. And, though we live on the opposite sides of the world, but we share the same passion and love for the people. Though his night is my day, but we're under the same sun and breathing the same air. And someday, we might meet again, or maybe not anymore. But, I'm just here waiting on the dance floor, for him to dance with me. ###","2016-05-09 2:50am","40.748400","-73.996700"
"The beating of your heart... - w4m","I hope you had a wonderful Mother's Day with your Mama. She deserves your attention and love right now. I have never forgotten you and never will. I go weeks without being drawn back in, and then I hear something, etc...and I fall in love all over. I am tired of wearing this smile when inside, I don't know how much longer I can play ""our game."" I can't sleep and miss you like no other human being. Maybe we are from another part of the universe. Would you please explain why we can not let go? My love...","2016-05-09 1:57am"
"Pardon My Staring... Friday - m4w (Midtown West)","I am just some dorky guy with glasses and a short beard, but when you got on the uptown C train I couldn't help but stare at you in amazement (and I could tell that you noticed). You had short hair, were carrying a bouquet of flowers and wearing a pair of Blunnies. You are just about the very image of the woman I have always imagined and dreamed about, somehow. A feeling of seeing someone terribly familiar who I have never met. We both got off at 34th Street, probably around 1:40 on Friday afternoon. For a moment, on the platform (crowded strangely with cops at that moment), I was close enough to tap you on the shoulder, but of course I didn't. You know, there is just no way to tell a perfect stranger that she is a vision of astounding beauty without coming off like an idiot, and I was at a loss for anything else to say. Even I had said so, I guess my feelings would be of dubious value. I somehow imagine that dopey dingbats like me must fall in love with you every day, and I don't know anything about you, nor you about me. Ah well. Suffice it to say that just seeing your face from halfway across the subway car somehow melted and/or jolted me inside a bit, for whatever it is worth. Apologies for my stare - I hope I didn't disturb you.","2016-05-09 2:38am","40.748400","-73.996700","body : skinny"
"*sigh* - m4w","I can not understand that then? I understand that you do not want to change anything, but you could just tell it.","2016-05-09 2:12am","40.750718","-73.976579"
